{
  "schema_version": "0.1.0",
  "handoff_event_id": "handoff_gen03_004",
  "current_generation": 3,
  "next_generation": 4,
  "occurred_at": "2026-08-17T00:30:00Z",
  "trigger": {
    "type": "MILESTONE_COMPLETED",
    "mode": "NORMAL",
    "score": 0.62,
    "details": "Current implementation milestone completed."
  },
  "source_role": "BUILDER",
  "destination_role": "AUDITOR"
}
